_id,title,link,company,industry,level,location,website,webSiteId,jobDetails
ObjectId("5ad9202a5419a5acff156c53"),Graphic Designer,https://www.ejobs.ro/user/locuri-de-munca/graphic-designer/1036583,OSF Global Services SRL,IT / Telecom,Entry-Level (< 2 ani),Iasi,ejobs,1036583,"{"id":"1036583","requirments":[],"description":["Create forward thinking designs, illustrations, iconography in the digital design space including but not limited to: Website design, Mobile app design, Email design, Digital Product Branding","Marketing assets design (infographics, online banners, collateral, presentations etc.)","Consider responsive design guidelines and apply them to our web & mobile platforms, staying up-to-date with design application changes and industry developments.","Collaborate with both development and marketing teams.","Deliver projects to meet deadlines based on stakeholder’s requirements, ability to multitask and prioritize tasks.","Strong visual concept ideation and storytelling.","3 or more years of experience in the digital visual design field.","Degree in interaction design, graphic arts, other design-related field, or equivalent professional experience.","Portfolio demonstrating experience creating highly visual impactful designs that solve complex problems in web and mobile platforms.","Skills in typography, layout, illustration, iconography, wire framing, web, and mobile app design.","Demonstrated ability to influence projects from concept to delivery and ongoing improvement.","Mastery of standard Design Tools (Adobe CC) and digital presentation tools (Power Point).","Strong communication and interpersonal skills.","Ability to solve problems creatively and effectively.","Design experience in e-commerce websites is desired.","Knowledge in HTML & CSS is considered an asset.","Knowledge in large CMS systems such as Sitecore is considered an asset.","The option of working remotely","Flexible working schedule","Complimentary certifications and trainings","Performance evaluations that lead to financial compensations","Working with multi-cultural teams","International business exposure","Competitive medical plans","Coffee, fruits and a lot of fun in our offices across the world"],"companyDescription":"With headquarters in Quebec, Canada, we are a leading global cloud solutions company, with expertise in enterprise CRM, ecommerce, content management and cloud applications. Delivering innovative solutions to enterprises and emerging businesses across B2B and B2C sectors, our work ranges across the digital spectrum and includes websites large and small, mobile apps, CRM programs, customized tools, content and email marketing, SEO/SEM, social media marketing and many more."}"
ObjectId("5ad9202a5419a5acff156c54"),Helpdesk Field Engineer,https://www.ejobs.ro/user/locuri-de-munca/helpdesk-field-engineer/1025440,Conduent,IT / Telecom,Entry-Level (< 2 ani)|Mid-Level (2-5 ani),Iasi,ejobs,1025440,"{"id":"1025440","requirments":[],"description":[],"companyDescription":"Conduent is the world’s largest provider of diversified business process services with leading capabilities in transaction processing, automation, analytics and constituent experience. We work with both government and commercial customers in assisting them to deliver quality services to the people they serve. We manage interactions with patients and the insured for a significant portion of the U.S. healthcare industry. We are the customer interface for large segments of the technology industry and the operational and processing partner of choice for public transportation systems around the world. Whether it’s digital payments, claims processing, benefit administration, automated tolling, customer care or distributed learning – Conduent manages and modernizes these interactions to create value for both our clients and their constituents. In Romania, Conduent operates through 2 sites in Iasi, 1 in Bucharest and 1 in Oradea. Learn more at www.conduent.com."}"
ObjectId("5ad9202a5419a5acff156c55"),Front End Web Developer,https://www.ejobs.ro/user/locuri-de-munca/front-end-web-developer/1031894,Halfway UP,IT / Telecom,Entry-Level (< 2 ani)|Mid-Level (2-5 ani),Iasi,ejobs,1031894,"{"id":"1031894","requirments":[],"description":[],"companyDescription":"At HalfwayUp, we provide the broad range of skills and expertise that you need to handle your entire digital marketing campaign. From building a website, to increasing your online visibility, we can handle every facet of your brand online and help you to reach the widest audience possible. Over the last five years, we have worked with clients from just about every continent and every niche. In every case, we have helped them to fine-tune their brand, develop a site that they can be proud of, and manage a campaign to reach a massive audience.  Now We’re Expanding our Team in Iasi, Romania."}"
ObjectId("5ad9202a5419a5acff156c56"),Consultant Vanzari in magazin Vodafone Iasi,https://www.ejobs.ro/user/locuri-de-munca/consultant-vanzari-in-magazin-vodafone-iasi/1035291,NEW AGE COMMUNICATIONS SRL,Asigurari|Banci / Servicii financiare|Call-center / BPO|Comert / Retail|IT / Telecom,Entry-Level (< 2 ani),Iasi,ejobs,1035291,"{"id":"1035291","requirments":["Minim 1 an experienta de preferat in vanzari, lucrul cu clientii","Liceul Absolvit (Facultatea terminata reprezinta avantaj)","Foarte bune abilitati de comunicare interpersonala","Engleza fluent","Bune abilitati de lucru cu calculatorul: Word, Excel, Power Point, e-mail","Atitudine pozitiva si orientata catre client","Cunostiinte generale despre GSM si Internet","Bune abilitati si cunostiinte de vanzare"],"description":[],"companyDescription":"Franciza Vodafone este un model de business ce imbina experienta de retail Vodafone cu antreprenoriatul partenerilor de franciza. Magazinele din acest sistem au aceleasi standarde de imagine si calitate a serviciilor ca si magazinele Vodafone. Partenerii au acces la know-how-ul, sistemele si aplicatiile Vodafone, precum si la programele de pregatire pentru personalul de vanzari."}"
ObjectId("5ad9202a5419a5acff156c57"),Webdeveloper remote,https://www.ejobs.ro/user/locuri-de-munca/webdeveloper-remote/1035148,gett bv,IT / Telecom|Media / Internet,Mid-Level (2-5 ani)|Senior-Level (> 5 ani),Iasi,ejobs,1035148,"{"id":"1035148","requirments":[],"description":[],"companyDescription":"Webagency with focus on getting online results for their clients! With our pro team of 12 people, located in Netherlands and romania, we realise innovative websolutions for interesting customers."}"
ObjectId("5ad9202a5419a5acff156c58"),Service Delivery Coordinator with English,https://www.ejobs.ro/user/locuri-de-munca/service-delivery-coordinator-with-english/1030881,XEROX SHARED SERVICES ROMANIA SRL,IT / Telecom,Entry-Level (< 2 ani)|Mid-Level (2-5 ani),Iasi,ejobs,1030881,"{"id":"1030881","requirments":[],"description":["Act as a customer and internal point of contact for assigned contracts","Be responsible for the effective co-ordination of external / internal queries / escalations","Ensure feedback from the client is sent to the management team to drive the improvement of services","Support of asset management database to agreed data quality levels","Carry out quality checks to ensure quality standards are maintained","Track the performance against SLAs and KPIs;","Act as a centre of reference for Xerox systems","Responsible for coordinating end to end MACD - Move Add Change Delete","Liaise between customer and Xerox Supply Chain and logistics teams.","Maintain a Process and Procedure manual","Plan Service Improvement, including Root Cause Analysis","Coordinate and gather Financial data for monthly billing reconciliation","Contribute to the P&L performance through cost control and innovation","Have general knowledge of Xerox’s structural workings and what we sell","Provide necessary support for contract change management","Adhere to agreed processes","Maintain customer relationships","Participate in team meetings and general inputs in day to day improvements","The management of emails, phone calls to be done professionally and timely","Maintain standards when using Hub sites.","Other duties as required;"],"companyDescription":"Xerox Corporation (NYSE: XRX) is an $11 billion technology leader that innovates the way the world communicates, connects and works. Our expertise is more important than ever as customers of all sizes look to improve productivity, maximize profitability and increase satisfaction. We do this for small and mid-size businesses, large enterprises, governments, graphic communications providers, and for our partners who serve them. We understand what’s at the heart of work – and all of the forms it can take. We embrace the increasingly complex world of paper and digital. Office and mobile. Personal and social. Every day across the globe – in more than 160 countries – our technology, software and people successfully navigate those intersections. We automate, personalize, package, analyze and secure information to keep our customers moving at an accelerated pace."}"
ObjectId("5ad9202a5419a5acff156c59"),(Senior) Test Analyst,https://www.ejobs.ro/user/locuri-de-munca/senior-test-analyst/1030186,BEARINGPOINT SRL,IT / Telecom,Mid-Level (2-5 ani)|Senior-Level (> 5 ani),Iasi,ejobs,1030186,"{"id":"1030186","requirments":[],"description":[],"companyDescription":"We offer management and consulting services to achieve sustainable profitable growth of companies by improving their logistic, commercial, and financial processes."}"
ObjectId("5ad9202a5419a5acff156c5a"),Reprezentant vanzari,https://www.ejobs.ro/user/locuri-de-munca/reprezentant-vanzari/1029108,Avenir Telecom SA,IT / Telecom,Entry-Level (< 2 ani)|Mid-Level (2-5 ani),Iasi,ejobs,1029108,"{"id":"1029108","requirments":[],"description":[],"companyDescription":"Avenir Telecom este unul dintre principalii distribuitori europeni de produse si servicii de telefonie mobila. Grupul asigura distributia de telefoane si accesorii atat in mod direct, prin reteaua proprie de magazine marca Internity, cat si prin intermediul lanturilor de tip hipermarket si a retailerilor independenti. Avenir Telecom Romania, filiala locala detinuta integral de catre Grupul Avenir Telecom, a fost infiintata in 1997, are 220 de angajati si detine 51 de magazine Internity ce alcatuiesc o retea cu acoperire la nivel national."}"
ObjectId("5ad9202a5419a5acff156c5b"),International Recruitment Specialist - Proficient in English,https://www.ejobs.ro/user/locuri-de-munca/international-recruitment-specialist-proficient-in-english/1035164,Wallethub,Banci / Servicii financiare|IT / Telecom|Media / Internet|Prestari servicii,Entry-Level (< 2 ani)|Mid-Level (2-5 ani),Iasi,ejobs,1035164,"{"id":"1035164","requirments":[],"description":[],"companyDescription":"WalletHub is one of the leading personal finance destinations in the US, and it's rapidly growing its Romanian operation (currently over 40 members working remotely). Even though we are based in Washington, DC, most of our team members work remotely from every corner of the world and as such we provide a highly multicultural work environment.  You can also apply by emailing your CV and cover letter to hr@wallethub.com (please mention the position you're applying for in the subject line).  More details about Wallethub  We are harnessing the power of data analytics and artificial intelligence to build the brain of a smart financial advisor, whose services we’re offering to everyone for free. The WalletHub brain enables users to make better financial decisions in a fraction of the time with three unique features:  1) Customized Credit-Improvement Tips: WalletHub identifies improvement opportunities and guides you through the necessary corrections; 2) Personalized Money-Saving Advice: WalletHub’s savings brain constantly scours the market for load-lightening opportunities, bringing you only the best deals; 3) Wallet Surveillance: Personal finance isn’t as scary with 24/7 credit monitoring providing backup, notifying you of important credit-report changes.  In addition to the valuable intelligence the brain provides, WalletHub is the first and only service to offer free credit scores and full credit reports that are updated on a daily basis absent of user interaction, rather than weekly or monthly and only when a user logs in. Some other services hang their hats on free credit scores and reports, yet they’re still inferior to what WalletHub considers minor pieces to a much larger puzzle."}"
ObjectId("5ad9202a5419a5acff156c5c"),Customer Service Advisor with English,https://www.ejobs.ro/user/locuri-de-munca/customer-service-advisor-with-english/1033843,Capgemini Romania,Call-center / BPO|IT / Telecom,Entry-Level (< 2 ani)|Mid-Level (2-5 ani),Iasi,ejobs,1033843,"{"id":"1033843","requirments":[],"description":[],"companyDescription":"A global leader in consulting, technology services and digital transformation, Capgemini is at the forefront of innovation to address the entire breadth of clients’ opportunities in the evolving world of cloud, digital and platforms. Building on its strong 50-year heritage and deep industry-specific expertise, Capgemini enables organizations to realize their business ambitions through an array of services from strategy to operations. Capgemini is driven by the conviction that the business value of technology comes from and through people. It is a multicultural company of 200,000 team members in over 40 countries. The Group reported 2016 global revenues of EUR 12.5 billion.  Visit us at www.capgemini.com. People matter, results count."}"
ObjectId("5ad9202a5419a5acff156c5d"),Administrative Assistant (Remote job / Homework),https://www.ejobs.ro/user/locuri-de-munca/administrative-assistant-remote-job-homework/1032663,Musix AG Switzerland,Comert / Retail|Publicitate / Marketing / PR|Banci / Servicii financiare|Transport / Logistica / Import - Export|IT / Telecom,Entry-Level (< 2 ani)|Mid-Level (2-5 ani),Iasi,ejobs,1032663,"{"id":"1032663","requirments":[],"description":[],"companyDescription":"MusiX is one of the leading suppliers for musical instruments in Switzerland and with a focus on the European Market for the future. We started very small and grew since 12 years from a team of 3 members to a team of more that 50 employees now. Using technology in the best possible way in order to offer a better service to our customers is one of our principles. Furthermore, thanks to modern technology, we can also manage to work in a decentralize way and we like to work together as a team both locally together and also remotely (working from home). In order to support our management, we're looking for a Personal Assistant / Executive Assistant for a full time and permanent role with the possibility to work from home. Within the first 3 months, the training will take place at our head office in Switzerland (travel and accommodation are fully covered by the company), and afterwords you will return home and continue working 100% in a permanent role."}"
ObjectId("5ad9202a5419a5acff156c5e"),Auchan Executive Graduate Program,https://www.ejobs.ro/user/locuri-de-munca/auchan-executive-graduate-program/1028640,AUCHAN RETAIL ROMANIA,Comert / Retail|Farma|IT / Telecom|Textila|Transport / Logistica / Import - Export,Entry-Level (< 2 ani)|Mid-Level (2-5 ani),Iasi,ejobs,1028640,"{"id":"1028640","requirments":[],"description":[],"companyDescription":"Auchan Retail este unul dintre cele mai importante lanturi comerciale, locul 11 în lume, prezent în 17 tari, cu peste 3.700 magazine si aproape 350.000 de angajati."}"
ObjectId("5ad9202a5419a5acff156c5f"),Sales representative,https://www.ejobs.ro/user/locuri-de-munca/sales-representative/1017988,ETA2U,IT / Telecom,Senior-Level (> 5 ani)|Mid-Level (2-5 ani),Iasi,ejobs,1017988,"{"id":"1017988","requirments":[],"description":[],"companyDescription":"Descrierea companieiETA2U SRL - companie activa pe piata IT din Romania din 1992 - inseamna o echipa cu peste 240 specialisti IT certificati si o cifra de afaceri de peste 34 milioane euro.  ETA2U este principalul integrator de sisteme şi soluţii IT complexe din vestul si centrul României, furnizor de produse şi servicii IT și una dintre cele mai certificate companii din IT-ul românesc (tehnic, comercial și de calitate).  Performanță constant recunoscută prin nominalizări anuale în topurile naționale:  în 2016 ETA2U a fost anunțată ca ocupând locul 2 în Topul celor mai mari integratori IT&C după cifra de afaceri dintre companiile private cu capital românesc. în 2013 ETA2U a fost anunțată ca ocupând locul 3 în Topul celor mai mari integratori IT&C după cifra de afaceri dintre companiile private cu capital românesc.  Incurajam creativitatea si inovatia sprijinim tinerii entuziasti talentati, pasionati, motivati sa performeze si sa-si dezvolte cariera profesionala.Asiguram un mediu de lucru bazat pe dialog,incredere,respect reciproc si cooperare."}"
ObjectId("5ad9202a5419a5acff156c60"),REPREZENTANT DE VANZARI,https://www.ejobs.ro/user/locuri-de-munca/reprezentant-de-vanzari/1028662,,IT / Telecom|Energetica|Comert / Retail|Banci / Servicii financiare,Entry-Level (< 2 ani)|Mid-Level (2-5 ani),Iasi,ejobs,1028662,"{"id":"1028662","requirments":[],"description":[],"companyDescription":"Compania, este partenerul regional ENEL, furnizor de energie electrica si servicii adiacente acestui domeniu. Ca urmare a procesului de extindere, ne dorim dezvoltarea echipelor de vanzari in judetele IASI, NEAMT, BOTOSANI, BUZAU si BACAU  Ce oferim: Compania ofera salariu fix garantat, bonusuri lunare si trimestriale neplafonate, relationate cu performantele individuale. Venituri financiare mult peste medie. Asigurare medicala atat pentru angajat cat si pentru un membru al familiei. Contract de munca Full time. Oportunitatea de a lucra intr-un domeniu nou, de viitor si foarte bine platit. Oportunitati reale de dezvoltare profesionala."}"
ObjectId("5ad9202a5419a5acff156c61"),Consultant Vânzări Software,https://www.ejobs.ro/user/locuri-de-munca/consultant-v-nz-ri-software/1030156,Quartz Matrix,Energetica|IT / Telecom|Educatie / Training,Mid-Level (2-5 ani)|Senior-Level (> 5 ani),Iasi,ejobs,1030156,"{"id":"1030156","requirments":[],"description":[],"companyDescription":"Quartz Matrix"}"
ObjectId("5ad9202a5419a5acff156c62"),Online Marketer,https://www.ejobs.ro/user/locuri-de-munca/online-marketer/1030398,KIKLAB LTD,IT / Telecom|Media / Internet,Entry-Level (< 2 ani)|Mid-Level (2-5 ani),Iasi,ejobs,1030398,"{"id":"1030398","requirments":["Crearea de articole creative pentru site-urile si paginile de Facebook ale clientilor nostri;","Crearea de materiale (in special imagini) pentru postari Facebook/Instagram;","Comunicarea cu echipa in vederea stabilirii strategiilor de promovare;","Mentinerea relatiei cu clientii si dezvoltarea relatiilor cu potentiali parteneri: Bloggeri, Forumuri, Reviste, Agentii PR, Presa."],"description":[],"companyDescription":"Suntem o echipa tanara reunita sub sigla KIKLAB cu scopul de a crea software si site-uri web atat pentru clienti autohtoni cat si internationali. Cerinta pentru servicii de marketing este de asemeni in crestere, in special pentru Facebook si Google advertising, asa ca daca simti ca esti un marketer cu idei grozave, te asteptam sa aplici pentru acest job!"}"
ObjectId("5ad9202a5419a5acff156c63"),Java Developer,https://www.ejobs.ro/user/locuri-de-munca/java-developer/1030295,SYNERTRADE,IT / Telecom,Mid-Level (2-5 ani)|Senior-Level (> 5 ani),Iasi,ejobs,1030295,"{"id":"1030295","requirments":["You have 3+ years experience working in Java Web applications;","You possess very deep understanding of Spring Framework;","You have a deep understanding of Hibernate ORM or any JPA;","You have experience working with relational databases, such as: Microsoft SQL or MySQL or Oracle Relational Database Management System;","Nice to have: Web Services, Struts 1;","You possess quality orientation and analytical thinking;","You are good in verbal and written English;","You like to work within a team;"],"description":["You will play an active role in the development of the next generation of our successful SaaS application;","You will work in a phenomenal agile team making sure the software follows our high internal quality standards;","You will dedicatedly engage issues and communicate smart solutions to the team and also product partners;","A dynamic team of strong professionals that drive the creation of creative software solutions;","Open and pleasant work atmosphere;","Very competitive salary package;","Relocation package;","Excellent private health insurance and other benefits;"],"companyDescription":"Are we the right company for you? With over 500 customers worldwide, SynerTrade is a leading global provider of digital procurement solutions. Its cloud-based platform, SynerTrade Accelerate, covers the entire purchasing process thanks to a set of flexible applications, easy to use. SynerTrade Accelerate, our web application, is a complete eProcurement Suite that handles 500+ billion euros spend each year, and widens the performance of Procurement and Finance departments in companies such as Adeo, Alstom, Audi, Baloise Insurance, Decathlon, Deka Bank, Engie Groupama, Lafarge, Lindt, Lufthansa, Saint-Gobain, Sanofi, Shiseido, Total, Transdev, Yves Rocher, etc. With 16 offices worldwide and a 24/7 assistance in 10 languages, SynerTrade brings real expertise and a local service to its customers to optimize their purchasing processes around e-sourcing, e-procurement, SRM (Supplier Relationship Management), spend analysis and purchasing intelligence, or even product innovation management. We are an equal opportunity employer and value diversity at our company. We do not discriminate on the basis of race, religion, color, national origin, gender, sexual orientation, age, marital status, veteran status, or disability status. SynerTrade is one of the Software entities of Digital Dimension, member of the Econocom Group. For more information about us, please visit our website: http://www.synertrade.com."}"
ObjectId("5ad9202a5419a5acff156c64"),Software Development Engineer for Embedded Systems,https://www.ejobs.ro/user/locuri-de-munca/software-development-engineer-for-embedded-systems/1029428,S.C. Miele Tehnica SRL,IT / Telecom,Mid-Level (2-5 ani)|Senior-Level (> 5 ani),Iasi,ejobs,1029428,"{"id":"1029428","requirments":[],"description":[],"companyDescription":"Miele Tehnica is a subsidiary of Miele & Cie. KG, Germany. We produce electronic components for a wide range of Miele appliances, such as washing machines, tumble dryers, vacuum cleaners, ovens and others. The products Miele offers to its customers set the standards for durability, performance, ease of use, energy efficiency, design and service products."}"
ObjectId("5ad9202a5419a5acff156c65"),Content Writer / Copywriter in English,https://www.ejobs.ro/user/locuri-de-munca/content-writer-copywriter-in-english/1030078,WORD2GO SRL,Turism / HoReCa|Publicitate / Marketing / PR|Prestari servicii|IT / Telecom|Media / Internet,Entry-Level (< 2 ani)|Mid-Level (2-5 ani),Iasi,ejobs,1030078,"{"id":"1030078","requirments":[],"description":["Capable of writing clear, concise and grammatically correct content – only in English","Skilled in copywriting, creative writing, copyediting and proofreading","Fast researcher, great attention to details","Creative, talented, sociable, entertaining","At least 1 year of experience in copywriting (hobby or work) or similar activities","Knows how to sell","Persuasive","Excellent capabilities to work under pressure and meet deadlines","Microsoft Word operating knowledge","Good personal communication skills, thoroughness and self-organization abilities","Multitasking capability","A friendly person, who wants to be part of a young team of copywriters","Basic SEO knowledge (Search Engine Optimization)","WordPress operating knowledge","Cryptocurrency knowledge (Bitcoin, Ethereum etc.)","Traveler spirit 😊","Writing original, new, well-researched and unique content – very important","Writing/Copywriting articles and posts for blogs and websites (Travel, Cryptocurrency, App/Product Review and others - Celebs, Beauty, Health, etc)","Writing content for websites (Presentation, About me etc.)","Creating Press Releases","Writing clear, persuasive, original content","Proofread content to check spelling and grammar, Edit content, etc.","Gather free copyright images for articles (several sources will be made available to you)"],"companyDescription":"We offer you:  Attractive salary Bonuses based on performance Friendly office atmosphere The opportunity to develop your writing skills in English and, especially, to develop yourself The acquisition of skills in the field of copywriting and SEO content Challenging and motivating projects We encourage you to express your creativity and ideas through your work   If you feel that you find yourself in our description and you want to collaborate with us in the future, we look forward to your CV along with some previous works of yours!"}"
ObjectId("5ad9202a5419a5acff156c66"),Windows administrator,https://www.ejobs.ro/user/locuri-de-munca/windows-administrator/1035415,COMODO ROMANIA,IT / Telecom,Mid-Level (2-5 ani)|Senior-Level (> 5 ani),Iasi,ejobs,1035415,"{"id":"1035415","requirments":[],"description":[],"companyDescription":"Enter Comodo, a company that has been built upon the very foundation of trust, believing that every single digital transaction must have a built-in layer of trust and security. Thousands of companies and organizations rely on Comodo's technology to authenticate, validate and secure their most precious asset – information - and to combat constant malware threats and cyberattacks that are creating havoc on a global scale."}"
