_id,title,link,company,industry,level,location,website,webSiteId,jobDetails
ObjectId("5ad9202a5419a5acff156c13"),MPS Process Manager with English,https://www.ejobs.ro/user/locuri-de-munca/mps-process-manager-with-english/1030869,XEROX SHARED SERVICES ROMANIA SRL,IT / Telecom,Mid-Level (2-5 ani)|Senior-Level (> 5 ani),Iasi,ejobs,1030869,"{"id":"1030869","requirments":["Industry experience in computer science or business administration or a related field","Strong experience of IT, service delivery or consulting coupled with financial P&L responsibility, strong people management experience, projects and client interaction experience","Ability to lead and inspire individuals and teams in direct, shared or virtual roles","Demonstrated ability to work collaboratively - and lead - in a matrix management environment","Experienced in integrating customer and operational requirements into supplier relationships, including delivery partnerships","Relevant language skills","Demonstrable experience of having designed and implemented significant productivity as well as customer satisfaction improvements."],"description":["Responsible for establishing operational processes, escalation processes locally and in line with GSD Model. Management process with Capability and Delivery GM’s, Escalation Management with Value Chain Partners and Mentor/Coach for SDM’s including problem resolution in support of contracts and working with CADM’s.","Role model the New Xerox culture change across the Service Delivery and Xerox.","Delivering service that meets SLA and delights the customer (KPI: SLA achieved & high customer satisfaction)","Achieving productivity improvements (KPI: Value for customer, enhanced margin and P&L performance)","Supporting the transformation and growth of the business (KPI: Further profitable service revenue)","Developing strong relationships and teams (KPI: Strong network in place & people development is evident)","The role should ensure compliance to Global Service Delivery Model and specific processes for the Service Delivery Managers","This is a management role, with responsibilities within a matrixed environment supporting RSDM’s and ensuring operational readiness from a process perspective.","Develops departmental plans, including business, production and/or organizational priorities","Interprets internal or external business issues and recommends solutions/best practices","Decisions are guided by resource availability and functional objectives","Indirectly supports team of Service Delivery Managers in Rightshore location(s) via the defined matrix structure","Manages and develops a RACI to control all aspects of interaction between the onshore and Rightshore Service Delivery Management teams, identifying and managing any exceptions","Manages the governance process between onshore management and Rightshore Service Delivery Managers, ensuring a consistent approach across all team members","Monitors execution of defined training and development plans, including targeted experiential learning, for the Service Delivery Managers in Rightshore location(s) via the defined matrix structure. Includes periodic skills re-evaluation to ensure a continuous benchmarking of talent and training needs","Supports Service Delivery Managers and Client Account Delivery Managers with specific customer or account escalations","Supports decision making concerning enrolment of new accounts in Rightshore location(s)","Ensures a consistent approach in the transition of existing and new accounts to Rightshore location(s)","Acts as a key interface for continuous improvement initiatives relating to the Rightshore team of Service Delivery Managers","Monitors capacity and utilisation of the Rightshore Service Delivery Management (SDMs) team","Provides a focus for SLA management and customer satisfaction across the relevant customer base. Ensure the information systems and the review structure for SLAs and client satisfaction are in place and effectively used","Continuous and demonstrable improvement of productivity resulting in increased cost effectiveness and value. Be able to evidence these savings across relevant customer base","Ensures and monitors that processes are in place to pro-actively protect consistent service quality through rigorous management of change control and acceptance into service procedures in line with Service Delivery governance guidance","Ensures resources, capabilities and capacity to meet both existing and new business demand","Provides expert problem management support to difficult, high profile customer issues and ensures root-cause analysis is conducted and a corrective action plan is followed through with any learning applied for future benefit","Oversees the integration of all service delivery units and constantly improves the quality and inter-working of the whole virtual service team, including other Xerox service partners and suppliers to ensure a seamless end-to-end delivery of service for clients.","Ensures robust tools and - where relevant - technological platforms are in place to support customer environment and best service solution","Ensures compliance to financial management and governance processes (ensuring outlooks plans completed on time and support in closing gaps if needed )","Champions team-working, re-use, knowledge sharing and promotes the increased use of Shared Services capability and Knowledge Management practices"],"companyDescription":"Xerox Corporation (NYSE: XRX) is an $11 billion technology leader that innovates the way the world communicates, connects and works. Our expertise is more important than ever as customers of all sizes look to improve productivity, maximize profitability and increase satisfaction. We do this for small and mid-size businesses, large enterprises, governments, graphic communications providers, and for our partners who serve them. We understand what’s at the heart of work – and all of the forms it can take. We embrace the increasingly complex world of paper and digital. Office and mobile. Personal and social. Every day across the globe – in more than 160 countries – our technology, software and people successfully navigate those intersections. We automate, personalize, package, analyze and secure information to keep our customers moving at an accelerated pace."}"
ObjectId("5ad9202a5419a5acff156c14"),Logistic Planner English - Romania,https://www.ejobs.ro/user/locuri-de-munca/logistic-planner-english-romania/1029773,Truck Transfer,Call-center / BPO|Transport / Logistica / Import - Export|IT / Telecom,Mid-Level (2-5 ani)|Entry-Level (< 2 ani),Iasi,ejobs,1029773,"{"id":"1029773","requirments":[],"description":[],"companyDescription":"Over the past five years, Truck Transfer has provided top quality service for clients in need of trucking assistance.Vehicle transportation is a vital part of many companies’ operations, and many businesses that use an internal staff of drivers or local transfer companies are operating at suboptimal rates."}"
ObjectId("5ad9202a5419a5acff156c15"),Technical Support with English,https://www.ejobs.ro/user/locuri-de-munca/technical-support-with-english/1036212,XEROX SHARED SERVICES ROMANIA SRL,IT / Telecom,Mid-Level (2-5 ani),Iasi,ejobs,1036212,"{"id":"1036212","requirments":["You have 1 or more years of IT network knowledge/implementation experience (e.g., Microsoft Server and Workstation OS, (secure) network topologies/architectures)","You have MS Office professional tools suite experience","You are an analytical thinker who solves problems and develops continually more effective solutions to them","You can make informed decisions quickly and leverage your communication abilities to implement them"],"description":[],"companyDescription":"Xerox Corporation (NYSE: XRX) is an $11 billion technology leader that innovates the way the world communicates, connects and works. Our expertise is more important than ever as customers of all sizes look to improve productivity, maximize profitability and increase satisfaction. We do this for small and mid-size businesses, large enterprises, governments, graphic communications providers, and for our partners who serve them. We understand what’s at the heart of work – and all of the forms it can take. We embrace the increasingly complex world of paper and digital. Office and mobile. Personal and social. Every day across the globe – in more than 160 countries – our technology, software and people successfully navigate those intersections. We automate, personalize, package, analyze and secure information to keep our customers moving at an accelerated pace."}"
ObjectId("5ad9202a5419a5acff156c16"),Web Developer PHP & MySQL,https://www.ejobs.ro/user/locuri-de-munca/web-developer-php-mysql/1030262,Webmagnat,IT / Telecom,Entry-Level (< 2 ani)|Mid-Level (2-5 ani),Iasi,ejobs,1030262,"{"id":"1030262","requirments":["Studii universitare in domeniul Informatica si Calculatoare sau experiență relevantă in acest domeniu reprezintă un avantaj","Etica profesională puternică - o persoană care se mândrește cu profesionalismul, responsabilitatea și proactivitatea.","Cunostinte medii ale limbajului PHP 5+/7 (OOP) cu accent pe securitate, performanta si optimizare","Experiență de lucru cu HTML5,CSS3,JavaScript, jQuery","Cunostinte medii de proiectare si interogare a bazelor de date relationale folosind MySQL 5 cu accent pe performanta si optimizare;","Cunostinte medii Smarty Template Engine - lucru cu templateuri, caching.","Capacitatea de a lucra în echipă;","Respectarea termenelor limita;","Creativitate, organizare, seriozitate, atentie la detalii."],"description":["Colaborați îndeaproape cu membrii echipei de bază pentru a dezvolta și implementa aplicatiile web repartizate.","Învățați și implementați tehnologii noi și interesante pentru a ține pasul noutatile din domeniul IT.","Mențineți codul existent (remediați erorile, refactorizati codul existent in functie de noutatile din domeniul dezvoltarii web)","Participați la întâlnirile Agile, code reviews, UI / UX design reviews și alte caracteristici legate de întâlniri"],"companyDescription":"Oferta WebMagnat:  Salariu competitiv (bazat pe aptitudinile tale); Mediu de lucru pozitiv, echipa tanara si motivata; Oportunități de a te dezvolta personal și profesional; Flexibilitate. "}"
ObjectId("5ad9202a5419a5acff156c17"),Operations Executive with German,https://www.ejobs.ro/user/locuri-de-munca/operations-executive-with-german/1035610,XEROX SHARED SERVICES ROMANIA SRL,Call-center / BPO|IT / Telecom,Entry-Level (< 2 ani)|Mid-Level (2-5 ani),Iasi,ejobs,1035610,"{"id":"1035610","requirments":["Strong IT skills capable of using multiple Xerox systems with training","Ability to liaise with clients – obtain data over the phone","Understanding of workflow processes and ability to change.","Attention to detail","Proactive approach and self-motivated","Good communication skills both verbal and written","Ability to build strong relationships with remote delivery organization","Language competency – good level of English and German","MS skills – good level of Excel"],"description":["Solves problems brought to their attention by the customer (internal or external)","Contribute to more efficient work processes","Carry out quality checks to ensure quality standards are maintained","Centre of competence on XDM, XSM and XRM","Ensures effective shared mailbox management","Participate in team meetings and general inputs in day to day improvements","Meter Read and Billing","Asset Management and MACD","Management Information"],"companyDescription":"Xerox Corporation (NYSE: XRX) is an $11 billion technology leader that innovates the way the world communicates, connects and works. Our expertise is more important than ever as customers of all sizes look to improve productivity, maximize profitability and increase satisfaction. We do this for small and mid-size businesses, large enterprises, governments, graphic communications providers, and for our partners who serve them. We understand what’s at the heart of work – and all of the forms it can take. We embrace the increasingly complex world of paper and digital. Office and mobile. Personal and social. Every day across the globe – in more than 160 countries – our technology, software and people successfully navigate those intersections. We automate, personalize, package, analyze and secure information to keep our customers moving at an accelerated pace."}"
ObjectId("5ad9202a5419a5acff156c18"),Helpdesk Agent with English and/or Spanish,https://www.ejobs.ro/user/locuri-de-munca/helpdesk-agent-with-english-and-or-spanish/1035218,GfK Romania – Institut de cercetare de piata S.R.L.,Call-center / BPO|IT / Telecom|Media / Internet|Publicitate / Marketing / PR,Entry-Level (< 2 ani)|Mid-Level (2-5 ani),Iasi,ejobs,1035218,"{"id":"1035218","requirments":[],"description":[],"companyDescription":"GfK is the trusted source of relevant market and consumer information that enables its clients to make smarter decisions. More than 13,000 market research experts combine their passion with GfK’s long-standing data science experience. This allows GfK to deliver vital global insights matched with local market intelligence from more than 100 countries. By using innovative technologies and data sciences, GfK turns big data into smart data, enabling its clients to improve their competitive edge and enrich consumers’ experiences and choices. "}"
ObjectId("5ad9202a5419a5acff156c19"),Service Delivery Manager,https://www.ejobs.ro/user/locuri-de-munca/service-delivery-manager/1030880,XEROX SHARED SERVICES ROMANIA SRL,IT / Telecom,Mid-Level (2-5 ani)|Senior-Level (> 5 ani),Iasi,ejobs,1030880,"{"id":"1030880","requirments":["Minimum: Bachelor's Degree","Preferred Relevant professional qualifications (e.g. ITIL, Lean Six Sigma, PMI)","Minimum of 5 Yrs experience of having successfully operated at prime customer contact level","Minimum of 5 Yrs Service delivery management experience having lead high quality service delivery to customer(s)","Business unit or contract budget ownership with experience of P&L management.","ITIL aligned experience of having designed and implemented productivity as well as customer satisfaction improvements.","Strong IT industry knowledge. Technical background a bonus with specific focus on the delivery of managed services..","Experience working in a virtual environment.","Preferred experience in outsourcing bids, from pre-sales to successful implementation","Strong presentation skills with experience of presenting to senior customer representatives.","Proven experience of /supplier management","Minimum Demonstrated ability to work collaboratively - within a matrix management environment","Minimum Experienced in integrating customer and operational requirements into supplier relationships, including delivery partnerships","Minimum Relevant language skills","Regular travel and face to face meetings with clients as required","Experience working across Countries and Cultures.","Experience of working in a virtual environment."],"description":["Accountable for managing service delivery for one or more client accounts - often across multiple sites and countries.","Consistent and measured delivery of service to SLA.","Provides support to new business opportunities. Takes an active role in bids and supports the transition and implementation of new business (including new service offers).","Continuous and demonstrable improvement of productivity resulting in increased cost effectiveness and value. Be able to evidence these savings across relevant customer base","In conjunction with the CADM, ensures resources, capabilities and capacity to meet both existing and new business demand.","Ensures processes are in place to pro-actively protect consistent service quality through rigorous management of change control and acceptance into service procedures in line with Service Delivery governance guidance.","Provides expert problem management support to difficult, high profile customer issues and ensures root-cause analysis is conducted and a corrective action plan is followed through with any learning applied for future benefit","Constantly improves the quality and inter-working of the whole virtual service team, including other Xerox partners and suppliers.","Ensures the client contractual targets and measurements are supported by back-to-back supplier commitments.","Ensures robust tools and - where relevant - technological platforms are in place to support customer environment and best service solution.","Motivates, develops and mentors other service delivery employees and managers.","Directly coordinate employees (as appropriate to the country, client account and service line).","Identifies same account growth opportunities to be converted into sales prospects.","Works directly with SDM L2 or CADM to create the contracts Account Business Plan for the year. Supports review and on-going input.","Accountable for managing service delivery for one or more client accounts - often across multiple sites and countries.","Consistent and measured delivery of service to SLA.","Provides support to new business opportunities. Takes an active role in bids and supports the transition and implementation of new business (including new service offers).","Continuous and demonstrable improvement of productivity resulting in increased cost effectiveness and value. Be able to evidence these savings across relevant customer base","In conjunction with the CADM, ensures resources, capabilities and capacity to meet both existing and new business demand.","Ensures processes are in place to pro-actively protect consistent service quality through rigorous management of change control and acceptance into service procedures in line with Service Delivery governance guidance.","Provides expert problem management support to difficult, high profile customer issues and ensures root-cause analysis is conducted and a corrective action plan is followed through with any learning applied for future benefit","Constantly improves the quality and inter-working of the whole virtual service team, including other Xerox partners and suppliers.","Ensures the client contractual targets and measurements are supported by back-to-back supplier commitments.","Ensures robust tools and - where relevant - technological platforms are in place to support customer environment and best service solution.","Motivates, develops and mentors other service delivery employees and managers.","Directly coordinate employees (as appropriate to the country, client account and service line).","Identifies same account growth opportunities to be converted into sales prospects.","Works directly with SDM L2 or CADM to create the contracts Account Business Plan for the year. Supports review and on-going input."],"companyDescription":"Xerox Corporation (NYSE: XRX) is an $11 billion technology leader that innovates the way the world communicates, connects and works. Our expertise is more important than ever as customers of all sizes look to improve productivity, maximize profitability and increase satisfaction. We do this for small and mid-size businesses, large enterprises, governments, graphic communications providers, and for our partners who serve them. We understand what’s at the heart of work – and all of the forms it can take. We embrace the increasingly complex world of paper and digital. Office and mobile. Personal and social. Every day across the globe – in more than 160 countries – our technology, software and people successfully navigate those intersections. We automate, personalize, package, analyze and secure information to keep our customers moving at an accelerated pace."}"
ObjectId("5ad9202a5419a5acff156c1a"),.NET / C# Programmer,https://www.ejobs.ro/user/locuri-de-munca/net-c-programmer/1035312,MIND Software,IT / Telecom,Entry-Level (< 2 ani)|Mid-Level (2-5 ani),Iasi,ejobs,1035312,"{"id":"1035312","requirments":[],"description":[],"companyDescription":"MIND CTI Ltd. is a leading provider of convergent end-to-end billing and customer care product based solutions for service providers as well as telecom expense management (call accounting) solutions. MIND provides a complete range of billing applications for any business model (license, managed service or complete outsourced billing service) for Wireless, Wireline, VoIP and Quad-play carriers in more than 40 countries around the world. A global company, with over twelve years of experience in providing solutions to carriers and enterprises, MIND operates from offices in the United States, UK, Romania and Israel."}"
ObjectId("5ad9202a5419a5acff156c1b"),JAVA Software Developers Iasi / Suceava,https://www.ejobs.ro/user/locuri-de-munca/java-software-developers-iasi-suceava/1032702,MIND Software,IT / Telecom,Entry-Level (< 2 ani)|Mid-Level (2-5 ani),Iasi,ejobs,1032702,"{"id":"1032702","requirments":[],"description":[],"companyDescription":"MIND CTI Ltd. is a leading provider of convergent end-to-end billing and customer care product based solutions for service providers as well as telecom expense management (call accounting) solutions. MIND provides a complete range of billing applications for any business model (license, managed service or complete outsourced billing service) for Wireless, Wireline, VoIP and Quad-play carriers in more than 40 countries around the world. A global company, with over twelve years of experience in providing solutions to carriers and enterprises, MIND operates from offices in the United States, UK, Romania and Israel."}"
ObjectId("5ad9202a5419a5acff156c1c"),Technical Support Engineers Iasi,https://www.ejobs.ro/user/locuri-de-munca/technical-support-engineers-iasi/1032692,MIND Software,IT / Telecom,Mid-Level (2-5 ani)|Senior-Level (> 5 ani),Iasi,ejobs,1032692,"{"id":"1032692","requirments":[],"description":[],"companyDescription":"MIND CTI Ltd. is a leading provider of convergent end-to-end billing and customer care product based solutions for service providers as well as telecom expense management (call accounting) solutions. MIND provides a complete range of billing applications for any business model (license, managed service or complete outsourced billing service) for Wireless, Wireline, VoIP and Quad-play carriers in more than 40 countries around the world. A global company, with over twelve years of experience in providing solutions to carriers and enterprises, MIND operates from offices in the United States, UK, Romania and Israel."}"
ObjectId("5ad9202a5419a5acff156c1d"),Sales Consultant Telekom,https://www.ejobs.ro/user/locuri-de-munca/sales-consultant-telekom/1028562,Active Power Solutions,IT / Telecom,Mid-Level (2-5 ani),Iasi,ejobs,1028562,"{"id":"1028562","requirments":[],"description":[],"companyDescription":"Active Power Solutions blends in the top corporate knowledge with the Romanian entrepreneurial DNA."}"
ObjectId("5ad9202a5419a5acff156c1e"),Technical Support Engineer (Phonex),https://www.ejobs.ro/user/locuri-de-munca/technical-support-engineer-phonex/1032693,MIND Software,IT / Telecom,Mid-Level (2-5 ani)|Senior-Level (> 5 ani),Iasi,ejobs,1032693,"{"id":"1032693","requirments":[],"description":[],"companyDescription":"MIND CTI Ltd. is a leading provider of convergent end-to-end billing and customer care product based solutions for service providers as well as telecom expense management (call accounting) solutions. MIND provides a complete range of billing applications for any business model (license, managed service or complete outsourced billing service) for Wireless, Wireline, VoIP and Quad-play carriers in more than 40 countries around the world. A global company, with over twelve years of experience in providing solutions to carriers and enterprises, MIND operates from offices in the United States, UK, Romania and Israel."}"
