_id,title,link,company,industry,level,location,website,webSiteId,jobDetails
ObjectId("5ad9202a5419a5acff156bf1"),Catalog Associate - Portuguese,https://www.ejobs.ro/user/locuri-de-munca/catalog-associate-portuguese/1031372,Amazon,Call-center / BPO|Comert / Retail|IT / Telecom|Media / Internet|Transport / Logistica / Import - Export,Entry-Level (< 2 ani)|Mid-Level (2-5 ani),Iasi,ejobs,1031372,"{"id":"1031372","requirments":[],"description":[],"companyDescription":"Since its launch in July 2011, RBS Romania became the main catalog service provider for the Amazon.it and Amazon.es portals, currently managing operations for all EU websites, as well as Mexico and Brazil. Our main activities focus on creating Amazon product pages, ensuring the content is accurate and up to date and resolving any issue that might appear on the supply chain. Today, our team consists in over 300 catalog specialists and continues to grow in order to cover for the ever-expanding Amazon business worldwide."}"
ObjectId("5ad9202a5419a5acff156bf2"),Service Desk Engineer with French - Iasi,https://www.ejobs.ro/user/locuri-de-munca/service-desk-engineer-with-french-iasi/1032199,SCC Services Romania,IT / Telecom,Entry-Level (< 2 ani)|Mid-Level (2-5 ani),Iasi,ejobs,1032199,"{"id":"1032199","requirments":[],"description":[],"companyDescription":"About SCC: We enable people to do business by planning, supplying, integrating and managing their IT. We make IT work through partnership, knowledge and passion: trusted to run IT infrastructure services for leading business across Europe for 40 years.  Mission  We are SCC – great things happen when we work together. To make IT work for our customers to improve the way they do business To deliver quality IT solutions and services that change the way businesses do business Deliver long-term profit to invest back into the business Nurture a winning network of partners to create enduring value to our customers.  Find out more at www.scc.com  Send your questions at cariera@scc.com. We’ll be glad to offer you more details!"}"
ObjectId("5ad9202a5419a5acff156bf3"),Back end/Front end .NET Developer (Junior/Middle),https://www.ejobs.ro/user/locuri-de-munca/back-end-front-end-net-developer-junior-middle/1033869,VAST VISIBILITY LIMITED LIVERPOOL SUCURSALA IASI,Imobiliara|IT / Telecom,Entry-Level (< 2 ani)|Mid-Level (2-5 ani),Iasi,ejobs,1033869,"{"id":"1033869","requirments":["Strong organizational and planning skills;","Ability to prioritize and multi-task;","Excellent attention to detail;","Good analytical and problem-solving experience;","Ability to priorities workloads according to demand;","Good Team Player;","Flexible working approach.","Degree in Computer Science or related discipline;","Minimum 6 months cross roles experience as a .NET developer for Junior, and minimum 2 years for Middle;","Good command of English both written and spoken;","Expertise in object-oriented software development .NET( ASP.NET,C#,WCF);","Relational database management system MSSQL Server;","Familiarity with VisualStudio and GIT;","Knowledge of software best practices and design patterns.","Knowledge of current Web technologies as HTML, JavaScript, Css and Ajax;","Familiarity with Continues Integration;","Familiarity with Agile and DevOps processes;","Knowledge of software best practices and design patterns."],"description":["Excellent salary benefits package;","Career development opportunities;","Stability on a continuously growing British-Romanian company;","Working with some of the biggest brands in the UK;","Training and Professional Certifications;","Professional multi-cultural development environment;","Health package / Sports package;","Flexible working schedule in start / finish time;","Excellent work environment;","Meal tickets;","Bi-annual reviews;","Team buildings activities and social events;","Other benefits to be discussed at final interview."],"companyDescription":"Most innovative and successful digital companies say they’re a family feel, game-changing, funky fresh company, but we actually mean it. We’re different in the way we work and the way we breed success. We’ve got a dog that roams the office, hangout rooms and one of our Directors comes into the office playing the ukulele occasionally. Office culture is important to us – it’s one of the reasons for our success and without it, we wouldn’t be where we are now. We started life in a bedroom in the northwest of England but in ten years we’ve been able to dominate the motorcycle insurance industry, establish ourselves in van insurance and take a foothold in the car insurance industry.  Collaboration is key to the success of vast:visibility – if our analysts don’t talk to our creatives and our creatives don’t talk to our tech teams, we’re not getting anything done. That’s why everyone’s encouraged to throw out ideas, why strategy meetings feature all parts of the company and why we get everyone together for an annual four day team building extravaganza (not to mention plenty of days and nights out in between).  The Vast Visibility Limited Liverpool Branch in Iasi is the technology development center of the business, delivering not only the platforms that have powered millions of quotes for motorbike, van, car, caravan and motorhome insurance quotes but also all of the suite of management information tools and control systems that sit around those platforms. Based in Iasi (Romania) and Liverpool (UK) since 2006, the business has gone from strength to strength. We pride ourselves on being innovators, leading the market by bringing new features and ways of comparing to our customers. In addition to supporting the ‘in house’ brands, The Bike Insurer and The Van Insurer, the company also provides platforms for major third party brands such as Confused.com, Asda, Autotrader, Admiral, MCN, Mustard.co.uk and more. In November 2016 the Group secured a strategic investment from fintech investor HgCapital.  This investment will further enhance the business’ capability to deliver not only its core aggregation services but will also unlock an exciting suite of innovative digital solutions including data enrichment, analytics, fraud detection and advertising platforms to the wider market. The business is currently 90 people strong (with c60 in Iasi, Romania) and is looking to extend its world class, commercially orientated team to fully unlock and extend both the capabilities of its market leading technology solutions and also the full potential of its ‘white label’ capabilities."}"
ObjectId("5ad9202a5419a5acff156bf4"),Software Engineer in Test,https://www.ejobs.ro/user/locuri-de-munca/software-engineer-in-test/1030265,GoDaddy EMEA,IT / Telecom,Entry-Level (< 2 ani)|Mid-Level (2-5 ani),Iasi,ejobs,1030265,"{"id":"1030265","requirments":[],"description":[],"companyDescription":"GoDaddy powers the world's largest cloud platform dedicated to small, independent ventures. With more than 17 million customers worldwide and more than 70 million domain names under management, GoDaddy is the place people come to name their idea, build a professional website, attract customers and manage their work. Our mission is to give our customers the tools, insights and the people to transform their ideas and personal initiative into success. To learn more about the company, visit www.heg.com. At present, with a workforce of approximately 150 individuals, GoDaddy EMEA in Romania is in full upsurge and progressively defining its profile as a fully fledged division of the main company."}"
ObjectId("5ad9202a5419a5acff156bf5"),Mid PHP Developer,https://www.ejobs.ro/user/locuri-de-munca/mid-php-developer/1030243,GoDaddy EMEA,IT / Telecom,Mid-Level (2-5 ani)|Senior-Level (> 5 ani),Iasi,ejobs,1030243,"{"id":"1030243","requirments":[],"description":["Design, develop, maintain and support software as a member of the Product Development Team.","Ensure software under development is managed with appropriate source code control and release processes.","Ensure software adheres to relevant coding standards and is documented using internal systems.Interact with the product managers to gather requirements, deploy and when relevant support our systems.","University degree or equivalent level education in Computing or a related discipline","PHP 5+/7, MVC framework is a plus","Good OOP skills","Web Services (SOAP, REST)","Good knowledge of design patterns","Focused on code quality and high development standards","Willing to adopt test driven development techniques","Git","Web development skills","HTML/DHTML/CSS/JavaScript","Experience with SQL databases (Mysql or PostgreSQL)","Working with any template engine (e.g: Smarty, Twig, Blade)","Agile (SCRUM)","phpUnit","Docker containers / virtualization of applications","Basic Linux/Unix commands on shell","Fluent English (verbal and written)"],"companyDescription":"GoDaddy powers the world's largest cloud platform dedicated to small, independent ventures. With more than 16 million customers worldwide and more than 70 million domain names under management, GoDaddy is the place people come to name their idea, build a professional website, attract customers and manage their work. Our mission is to give our customers the tools, insights and the people to transform their ideas and personal initiative into success. To learn more about the company, visit www.heg.com. At present, with a workforce of approximately 150 individuals, GoDaddy EMEA in Romania is in full upsurge and progressively defining its profile as a fully fledged division of the main company."}"
ObjectId("5ad9202a5419a5acff156bf6"),Software Developer,https://www.ejobs.ro/user/locuri-de-munca/software-developer/1030251,GoDaddy EMEA,IT / Telecom,Mid-Level (2-5 ani)|Senior-Level (> 5 ani),Iasi,ejobs,1030251,"{"id":"1030251","requirments":[],"description":["Designing and developing software solutions for high performance, high availability, low maintenance, and easy diagnosis of problems.","Resolving production issues detected by monitoring systems, data checks, or customer support tickets in a professional and timely manner.","Collaborating with an immediate team and peer teams to produce reusable software solutions that meet business initiatives and employ consistent design patterns.","Evaluating emerging technologies for opportunities to improve existing systems. We welcome innovators!","Providing suggestions to improve our customers’ experience.","4+ years of experience in software development using multiple modern languages, Java and C# preferred","2+ years of experience writing web applications, web services, and/or backend services, with customer-facing UI experience strongly preferred","2+ years of experience in automated testing is strongly preferred","Experience in Agile development methodologies strongly preferred","Experience in deployment to public cloud desired.","University degree or equivalent level education in Computing or a related discipline","Strong communication skills are required","SQL knowledge and relational database design","Very strong understanding of Object-Oriented Design and Service Oriented Architecture","Ability to drive projects through the lifecycle to completion, exercising creative ways to get issues resolved;"],"companyDescription":"GoDaddy powers the world's largest cloud platform dedicated to small, independent ventures. With more than 16 million customers worldwide and more than 70 million domain names under management, GoDaddy is the place people come to name their idea, build a professional website, attract customers and manage their work. Our mission is to give our customers the tools, insights and the people to transform their ideas and personal initiative into success. To learn more about the company, visit www.heg.com. At present, with a workforce of approximately 150 individuals, GoDaddy EMEA in Romania is in full upsurge and progressively defining its profile as a fully fledged division of the main company."}"
ObjectId("5ad9202a5419a5acff156bf7"),Consultant recuperari creante - Lb. Italiana,https://www.ejobs.ro/personalizat/consultant-recuperari-creante-/1032883,S.C. Fire Credit S.R.L.,Call-center / BPO|IT / Telecom|Prestari servicii,Entry-Level (< 2 ani)|Mid-Level (2-5 ani),Iasi,ejobs,1032883,"{"id":"1032883"}"
ObjectId("5ad9202a5419a5acff156bf8"),Senior .NET Software Developer **Telecommuting**,https://www.ejobs.ro/user/locuri-de-munca/senior-net-software-developer-telecommuting/1022131,OSS Nokalva, Inc.,IT / Telecom,Senior-Level (> 5 ani),Iasi,ejobs,1022131,"{"id":"1022131","requirments":[],"description":[],"companyDescription":"OSS Nokalva® is a leading vendor of ASN.1, 4G LTE and Efficient XML software development toolkits that empower companies worldwide to rapidly and reliably develop standards based applications. Instrumental in shaping and developing both standards, and related technologies, OSS Nokalva has been providing the most advanced and complete development tools since 1988."}"
ObjectId("5ad9202a5419a5acff156bf9"),Sharepoint Consultant in Iasi,https://www.ejobs.ro/user/locuri-de-munca/sharepoint-consultant-in-iasi/1037690,BEARINGPOINT SRL,IT / Telecom,Mid-Level (2-5 ani)|Senior-Level (> 5 ani),Iasi,ejobs,1037690,"{"id":"1037690","requirments":["4+ years of experience in Information Technology technical roles and customer-facing roles.","4+ years of experience in crafting solutions to solve technical and business problems, mainly around Microsoft platforms.","4+ years of industry experience with Microsoft products.","Experience with Office 365 deployments in the enterprise along with knowledge of other Office 365 features such as Office Online, Exchange, Skype for Business, Yammer, Power BI, and Delve.","Deep technical understanding of Office 365 sign-in models to include Cloud Identity, Synchronized Identity and Federated Identity including Azure Active Directory.","Acquainted with working in an Agile methodology.","SharePointnline.","SharePoint Client-Side Object Model (CSOM)."],"description":["Engaging with our customers to understanding business requirements and devise the most effective way of meeting those requirements as SharePoint based solutions.","Develop modern, user-driven solutions, using non-C# language.","Implement various SharePoint-based scenarios (hybrid configurations, farms reconfigurations, automations, etc.).","Running migrations of content from other platforms to Office 365 / SharePoint.","Use scripting and automation to apply updates and changes.","Propose improvements for the current applications landscape for various customers.","Collaborate with business users to manage content, workflow and customizations.","Troubleshooting and debugging Add-Ins (SHAs and PHAs) as well as WSPs.","Implement SharePoint monitoring solutions (server-side monitoring).","Implement various dashboards and solutions relying on SharePoint On-Premises and Online.","Track project details and status.","Document platform changes at high standards."],"companyDescription":""}"
ObjectId("5ad9202a5419a5acff156bfa"),Tehnician Dentar / Dental Technician,https://www.ejobs.ro/user/locuri-de-munca/tehnician-dentar-dental-technician/1037606,Heaven Solutions,Medicina / Sanatate|IT / Telecom,Mid-Level (2-5 ani)|Entry-Level (< 2 ani),Iasi,ejobs,1037606,"{"id":"1037606","requirments":[],"description":[],"companyDescription":"Our heart and foundation have always been our people. They are what makes Heaven Solutions a competent counterpart for a long-term partnership. Heaven Solutions is a fast growing technology company with offices in USA, Finland, Germany, and Romania. Our core competencies are business and IT alignment and transforming IT into a strategic asset. Our customer list includes industry leaders and role model companies. Our core values are trust, transparency, and honesty. Given this foundation, we consider each day a new challenge and strive for continuous improvement and innovation."}"
ObjectId("5ad9202a5419a5acff156bfb"),Website Designer & Developer - Wordpress,https://www.ejobs.ro/user/locuri-de-munca/website-designer-developer-wordpress/1039840,Spark Creative Marketing,Publicitate / Marketing / PR|Arta / Entertainment|IT / Telecom|Media / Internet,Mid-Level (2-5 ani)|Senior-Level (> 5 ani),Iasi,ejobs,1039840,"{"id":"1039840","requirments":[],"description":[],"companyDescription":"Spark Creative Marketing is a full service design studio based out of Astoria, NYC."}"
ObjectId("5ad9202a5419a5acff156bfc"),Sales Advisor - Vodafone Store Iasi,https://www.ejobs.ro/user/locuri-de-munca/sales-advisor-vodafone-store-iasi/1039845,Vodafone Romania,IT / Telecom,Mid-Level (2-5 ani)|Entry-Level (< 2 ani),Iasi,ejobs,1039845,"{"id":"1039845","requirments":["Ceilalti spun despre tine ca esti un bun negociator si te pricepi sa gasesti solutii?","Ai experienta de cel putin doi ani in vanzari?","Esti ambitios si iti place sa duci la capat tot ce iti propui?","Comunici ușor și te faci înțeles?","Dorești să te dezvolți și cauți o companie care să-ți ofere cursuri diversificate?","Iti doresti sa fii îndrumat de cineva care să te inspire?"],"description":["Oferi informatii relevante clientilor, gasesti cea mai buna solutie pentru ei si activezi serviciile contractate; Construiesti relații durabile cu clienții noștri;","Actionezi ca ambasador al brandului Vodafone","Ești orientat către perfomanță, atât a ta, cât și a echipei din care faci parte","Pregătire intensă în sesiuni de training cu durata de 2 săptămâni","Acces la o mare varietate de cursuri și resurse de învățare, prin platforma noastră internă Vodafone University","Participarea la concursuri si acordarea unor bonusuri care recompensează performanța individuală și pe cea de echipă;","Susținere și promovare în carieră;","Beneficii ca angajat Vodafone: abonament la o clinică medicală la alegere, abonament stomatologic și asigurare de viață pentru tine și pentru membrii familiei tale, accesul la o sală de sport, etc;","Abonament nelimitat de voce și date si accesul la oferte preferențiale pentru terminalele comercializate de Vodafone"],"companyDescription":"We want to inspire people to capture the opportunities of a digital future and build a better tomorrow. That is why we are here. Over 30 years ago, we made the first ever mobile phone call and sent the first SMS in Britain and have been changing the lives of billions of people ever since. We are taking 4G to the Moon and using big data for social good to intelligent transport systems and emergency drones, we are still shaking things up. Be part of a company which helps those who need it most. Whether teaching girls to code, providing connectivity to disaster hit areas or putting on our trainers and running for charity. We believe being different is good. We’re proud to offer equal opportunities regardless of race, nationality, cultural background, gender, age, marital status, sexual orientation, gender identity, disability, religious or political belief. We can only leverage this diversity by building an inclusive culture where everyone is respected, can be themselves and strive to be their best. Your different perspectives help us to shape the future. The future is exciting. Ready? "}"
ObjectId("5ad9202a5419a5acff156bfd"),Internship Software Test Engineer - Sibiu,https://www.ejobs.ro/user/locuri-de-munca/internship-software-test-engineer-sibiu/1039478,Marquardt Schaltsysteme SCS SIBIU,Masini / Auto|IT / Telecom|Media / Internet,Entry-Level (< 2 ani),Iasi,ejobs,1039478,"{"id":"1039478","requirments":[],"description":[],"companyDescription":"The history of the Marquardt Group beginns in 1925 as a family enterprise, in Rietheim-Weilheim Germany. Today it has 12 subsidiaries in Europe, Africa, Asia, America with over 6.000 employees. Marquardt opened its gates in Sibiu in 2006, having today four manufacturing segments: micro-switches, electronics, injection moulding and assambly. In 2008 the foundations had been laid for the R&D Center which has at present following activity domains: Software Development, Software Validation, Mechanical Design, PCB Layout design, Product Testing.  Marquardt is a company which is in continuous development both at a local and at an international level.  Contact Adress: Str. Munchen, Nr. 2, Sibiu E-mail: stefana.diaconescu@marquardt-ro.com Web: https://ro.marquardt.com"}"
ObjectId("5ad9202a5419a5acff156bfe"),QA Senior Catalog Associate - Spanish or Italian,https://www.ejobs.ro/user/locuri-de-munca/qa-senior-catalog-associate-spanish-or-italian/1031377,Amazon,Comert / Retail|Call-center / BPO|IT / Telecom|Media / Internet|Transport / Logistica / Import - Export,Entry-Level (< 2 ani)|Mid-Level (2-5 ani),Iasi,ejobs,1031377,"{"id":"1031377","requirments":[],"description":[],"companyDescription":"Since its launch in July 2011, RBS Romania became the main catalog service provider for the Amazon.it and Amazon.es portals, currently managing operations for all EU websites, as well as Mexico and Brazil. Our main activities focus on creating Amazon product pages, ensuring the content is accurate and up to date and resolving any issue that might appear on the supply chain. Today, our team consists in over 300 catalog specialists and continues to grow in order to cover for the ever-expanding Amazon business worldwide."}"
ObjectId("5ad9202a5419a5acff156bff"),Consumer in Business Consultant Vodafone,https://www.ejobs.ro/user/locuri-de-munca/consumer-in-business-consultant-vodafone/1039050,INSTORE POWER PROVIDER S.R.L.,Call-center / BPO|Comert / Retail|IT / Telecom|Publicitate / Marketing / PR,Entry-Level (< 2 ani)|Mid-Level (2-5 ani),Iasi,ejobs,1039050,"{"id":"1039050","requirments":[],"description":[],"companyDescription":"IPP - Instore Power Provider este jucător principal pe piata serviciilor de marketing pentru retail din Romania, cu o cifra de afaceri cumulata de 54 mil EUR, asigura clienților săi, producători si retaileri internaționali, servicii de reprezentare comercială, mercantizare, monitorizare, leasing de personal, formare si cerfiticare comercială."}"
ObjectId("5ad9202a5419a5acff156c00"),Inginer vanzari,https://www.ejobs.ro/user/locuri-de-munca/inginer-vanzari/1036866,PROCONSIL GRUP SRL,Asigurari|Comert / Retail|Energetica|IT / Telecom|Publicitate / Marketing / PR,Entry-Level (< 2 ani)|Mid-Level (2-5 ani),Iasi,ejobs,1036866,"{"id":"1036866","requirments":[],"description":[],"companyDescription":"Din anul 2004 oferim solutii pentru mententanta masinilor si utilajor industriale, ne ocupam de importul si distributia echipamentelor pentru industrie: motoare electrice, motoare electrice cu frana, reductoare de turatie, motoreductoare, lanturi gall, pinioane pentru lant gall, convertizoare de frecventa etc."}"
ObjectId("5ad9202a5419a5acff156c01"),Consilier Vanzari Telecomunicatii,https://www.ejobs.ro/user/locuri-de-munca/consilier-vanzari-telecomunicatii/1038598,SC Arsis Trading SRL,IT / Telecom|Comert / Retail,Entry-Level (< 2 ani)|Mid-Level (2-5 ani),Iasi,ejobs,1038598,"{"id":"1038598","requirments":[],"description":[],"companyDescription":"In cei 18 ani de parteneriat cu Vodafone am crescut constant si sanatos, iar astazi interactionam cu aproximativ 250.000 clienti pe luna in peste 160 de magazine in tara cu ajutorul a 500 de colegi. Asa cum spuneam si la inceput vom investi in continuare pentru a fi partenerul preferat de servicii de telecomunicatii din Romania."}"
ObjectId("5ad9202a5419a5acff156c02"),Grafician Jocuri (Remote),https://www.ejobs.ro/user/locuri-de-munca/grafician-jocuri-remote/1037092,Promedia Studio SRL,Arta / Entertainment|IT / Telecom|Media / Internet|Publicitate / Marketing / PR,Entry-Level (< 2 ani)|Mid-Level (2-5 ani),Iasi,ejobs,1037092,"{"id":"1037092","requirments":[],"description":[],"companyDescription":"We're a fully remote team of enthusiastic young people who create and publish mobile apps for kids. Our apps have over 25 000 000 downloads so far and the best thing about this is we're still counting!  Passion, energy and hard-work are the main ingredients for everything we're working on. We differentiate ourselves from our competitors by making sure our games are 100% safe and appropriate for children.  Our goals are big and we're getting closer to them every day. Become our partner in this. Let's grow together, we can't wait to e-meet you!"}"
ObjectId("5ad9202a5419a5acff156c03"),Frontend Developer,https://www.ejobs.ro/user/locuri-de-munca/frontend-developer/1030259,GoDaddy EMEA,IT / Telecom,Entry-Level (< 2 ani)|Mid-Level (2-5 ani),Iasi,ejobs,1030259,"{"id":"1030259","requirments":[],"description":[],"companyDescription":"GoDaddy powers the world's largest cloud platform dedicated to small, independent ventures. With more than 17 million customers worldwide and more than 70 million domain names under management, GoDaddy is the place people come to name their idea, build a professional website, attract customers and manage their work. Our mission is to give our customers the tools, insights and the people to transform their ideas and personal initiative into success. To learn more about the company, visit www.heg.com. At present, with a workforce of approximately 150 individuals, GoDaddy EMEA in Romania is in full upsurge and progressively defining its profile as a fully fledged division of the main company."}"
