_id,title,link,company,industry,level,location,website,webSiteId,jobDetails
ObjectId("5ad9202a5419a5acff156c2b"),Senior Full Stack Developer,https://www.ejobs.ro/user/locuri-de-munca/senior-full-stack-developer/1039753,Crowd Favorite,IT / Telecom,Senior-Level (> 5 ani),Iasi,ejobs,1039753,"{"id":"1039753","requirments":["Can write modern, standards-compliant PHP (in particular, can write to PHPCS WordPress standards using PHP7","Can write performant, functional, plain Javascript","Has familiarity with Laravel 5","Has a fundamental understanding of REST as well as APIs in general","Knows their way around MySQL (especially regarding building performant queries)","Is familiar with writing unit tests and acceptance tests","Has an understanding of issues related to scaling and high-performance websites","Has working knowledge of jQuery, React, or other commonly used javascript frameworks/libraries","Knows their way around a server—basic web server configuration, cron management, package management (apt or similar), basic shell familiarity, and other housekeeping skills","Can design, build, and maintain performant and well-organized databases","Has an understanding of virtualization and experience with some flavor of VirtualBox, Vagrant, Docker, etc.","Has an understanding of Git and adheres to a workflow, including deployment and continuous integration tools","Has familiarity with task runners and can contribute to front-end workflows (Gulp, NPM, Grunt, Bower, etc.)","Can collaborate with other engineers, designers, and business analysts in a remote team environment","Can review and interpret business and technical requirements and create working tasks","Amazon Web Services","Using and extending WP-CLI","Configuration and deployment of Redis, Memcached, and Varnish","Disconnected front-end websites from CMS back-ends.","Building and managing software testing, including Performance testing, Unit testing, Integration testing, Acceptance testing","Writing scripted migrations","Sharing your knowledge through training, blog posts, or documentation","Working in a fully remote position","Working on side projects"],"description":["You won’t be micromanaged. We’re not looking for order-followers. You’ll be given responsibility and flexibility to make your own decisions.","You’ll find a true balance. Crowd Favorite isn’t a boiler room. We’d generally rather you work smart and take time to recharge.","You’ll be part of a real team. We’re a tight-knit group that respects and supports each other. You’ll know your team has your back.","You’ll dig the perks. ​","A competitive benefits package","Flexibility, you can work from home","Premium membership to a leading private health system","We respect your holidays, including the ones arranged before starting with us","Bonuses","The possibility of growth in the company","And others!"],"companyDescription":"Crowd Favorite is a premier, boutique professional services firm focused on enterprise-level clients such as National Geographic, Lexus, DirecTV, Motorola, and several major movie studios. A leader in the WordPress community and the first WordPress professional services firm, Crowd Favorite has established offices throughout the world to deliver large-scale client projects. Crowd Favorite also provides consulting and web development services specializing in web applications and user experience. Crowd Favorite is a challenging and rewarding place to work and we are permanently looking for talent so if you are a smart programmer and if you are looking for a transformative experience, join us!"}"
ObjectId("5ad9202a5419a5acff156c2c"),Tehnician - montare sisteme digitale,https://www.ejobs.ro/user/locuri-de-munca/tehnician-montare-sisteme-digitale/1038652,WINK NETWORK,IT / Telecom,Entry-Level (< 2 ani)|Mid-Level (2-5 ani),Iasi,ejobs,1038652,"{"id":"1038652","requirments":[],"description":[],"companyDescription":"Cu o experiență de peste 10 ani în sectorul Out-of-Home, WINK este o companie de media specializată în gestionarea de reţele de digital signage, administrare și închiriere de spaţiu publicitar multimedia. Compania operează patru segmente de business principale pe piaţa de publicitate Out-of-Home: Mobilier urban, retail advertising, transport și outdoor advertising.  www.wink.ro jobs@wink.ro   Wink Public Multimedia is a Digital OOH Network that delivers informative and commercial content to consumers when they are on the go in public places, in transit, waiting (bus shelters), and in specific commercial locations (retail venue)."}"
ObjectId("5ad9202a5419a5acff156c2d"),Customer Service Advisor with Portuguese & English,https://www.ejobs.ro/user/locuri-de-munca/customer-service-advisor-with-portuguese-english/1033806,Manpower,Call-center / BPO|IT / Telecom|Media / Internet,Entry-Level (< 2 ani)|Mid-Level (2-5 ani),Iasi,ejobs,1033806,"{"id":"1033806","requirments":[],"description":[],"companyDescription":"Welcome to a world of opportunity. Welcome to Manpower! Are you looking for new and exiciting career challenges? Manpower helps you take the right street on the road to success! Find the answer to your hiring challenges - see who's looking for your skills! Register now at www.manpower.ro! ManpowerGroup Romania is one of the leaders in innovative workforce solutions, creating and delivering services that help clients meet their business and workforce objectives while enhacing their competitiveness. ManpowerGroup is present in Romania since 2003, with branches in Bucharest, Timisoara, Brasov, Cluj-Napoca, Iași, Craiova, Ploiești and Pitești. For more information, you can access www.manpower.ro or visit our visit us on Facebook at ManpowerGroup Romania."}"
ObjectId("5ad9202a5419a5acff156c2e"),Customer Service Advisor with Italian & English,https://www.ejobs.ro/user/locuri-de-munca/customer-service-advisor-with-italian-english/1033799,Manpower,Call-center / BPO|IT / Telecom|Media / Internet,Entry-Level (< 2 ani)|Mid-Level (2-5 ani),Iasi,ejobs,1033799,"{"id":"1033799","requirments":[],"description":[],"companyDescription":"Welcome to a world of opportunity. Welcome to Manpower!  Are you looking for new and exiciting career challenges? Manpower helps you take the right street on the road to success!  Find the answer to your hiring challenges - see who's looking for your skills! Register now at www.manpower.ro!  ManpowerGroup Romania is one of the leaders in innovative workforce solutions, creating and delivering services that help clients meet their business and workforce objectives while enhacing their competitiveness.  ManpowerGroup is present in Romania since 2003, with branches in Bucharest, Timisoara, Brasov, Cluj-Napoca, Iași, Craiova, Ploiești and Pitești.  For more information, you can access www.manpower.ro or visit our visit us on Facebook at ManpowerGroup Romania."}"
ObjectId("5ad9202a5419a5acff156c2f"),Customer Service Advisor with French & English,https://www.ejobs.ro/user/locuri-de-munca/customer-service-advisor-with-french-english/1033794,Manpower,Call-center / BPO|IT / Telecom|Media / Internet,Entry-Level (< 2 ani)|Mid-Level (2-5 ani),Iasi,ejobs,1033794,"{"id":"1033794","requirments":[],"description":[],"companyDescription":"Welcome to a world of opportunity. Welcome to Manpower!  Are you looking for new and exiciting career challenges? Manpower helps you take the right street on the road to success!  Find the answer to your hiring challenges - see who's looking for your skills! Register now at www.manpower.ro!  ManpowerGroup Romania is one of the leaders in innovative workforce solutions, creating and delivering services that help clients meet their business and workforce objectives while enhacing their competitiveness.  ManpowerGroup is present in Romania since 2003, with branches in Bucharest, Timisoara, Brasov, Cluj-Napoca, Iași, Craiova, Ploiești and Pitești.  For more information, you can access www.manpower.ro or visit our visit us on Facebook at ManpowerGroup Romania."}"
ObjectId("5ad9202a5419a5acff156c30"),Customer Service Advisor with German & English,https://www.ejobs.ro/user/locuri-de-munca/customer-service-advisor-with-german-english/1033844,Capgemini Romania | Iasi | Suceava,IT / Telecom,Entry-Level (< 2 ani)|Mid-Level (2-5 ani),Iasi,ejobs,1033844,"{"id":"1033844","requirments":[],"description":[],"companyDescription":"Capgemini, one of the world's foremost providers of consulting, technology and outsourcing services, a people company with more than 140,000 people worldwide, enables its clients to transform and perform through technologies. Capgemini provides its clients with insights and capabilities that boost their freedom to achieve superior results through a unique way of working, the Collaborative Business ExperienceTM. The Group relies on its global delivery model called Rightshore®, which aims to get the right balance of the best talent from multiple locations, working as one team to create and deliver the optimum solution for clients."}"
ObjectId("5ad9202a5419a5acff156c31"),Reprezentant vanzari,https://www.ejobs.ro/user/locuri-de-munca/reprezentant-vanzari/1039138,Prime Telecom,IT / Telecom,Mid-Level (2-5 ani)|Entry-Level (< 2 ani),Iasi,ejobs,1039138,"{"id":"1039138","requirments":[],"description":[],"companyDescription":" Prime Telecom, cu ajutorul solutiilor flexibile, de inalta calitate, sigure, rapide, inovatoare si rentabile, este unul din principalii furnizori de servicii integrate de comunicatii din regiune. Avem peste 18 ani de functionare activa pe piata romaneasca si europeana, cu un capital integral romanesc. Suntem prima companie de telecomunicatii care a furnizat servicii de transport si conectivitate in regim de neutralitate din tara. In gama de solutii si servicii, care se adreseaza exclusiv segmentului business to business si wholesale, se regasesc atat servicii standard de telecomunicatii, de infrastructura si solutii integrate, cat si solutii de telecom complexe precum: Carrier Ethernet MEF 2.0, Dark Fiber, DIA, Colocare, Hosting, Cyber Security, Cloud si VIOP – Office Virtual PBX. Venim in intampinarea solicitarilor din piata cu solutii de aplicatii software pentru zona de retail sau dezvoltate la cerere, adaptate pe nevoile clientilor, inclusiv pe segmentul inteligent, al Internetul lucrurilor. De-a lungul anilor am dezvoltat si implement peste 490 de solutii complete de securitate si supraveghere video, control acces si detectie incendiu. Prin specialistii nostri, certificati de catre organizatiile autorizate din tara sau din Europa, oferim servicii de consiliere, audit la solutiile existente, montaj si instalare, dar si mentenanta si servicii post garantie. Cea mai noua verticala din portofoliul nostru este cea de Eficienta energetica. Oferim solutii complete de iluminat cu led la interior si exterior, dar si statii de reincarcare vehicule electrice. Echipa noastra tehnica este formata din peste 90 de specialisti cu experienta in dezvoltarea retelelor si configurare software. Asigura mentenanta si suport 24/24h, 365/365 si o functionalitate de peste 99,8% in timp ce infrastructura proprie extinsa de fibra optica ne asigura conectarea locatiilor prompt si eficient. Sediul nostru central este situat in zona de nord a Bucurestiului, la doar 5 minute de mers pe jos de statia de metrou Pipera, in cladirea 20 a Centrului de afaceri Iride. In plus, avem sucursale si in Cluj, Iasi si Timisoara. Daca prezentarea de mai sus te-a facut curios si consideri ca descrierea jobului ti se potriveste, te invitam sa apesi butonul „Aplica job”. Daca intrunesti cerintele mentionate in anunt, daca abilitatile si cunostintele descrise in CV-ul tau ne vor convinge tine telefonul aproape, te vom contacta pentru programarea unei discutii detaliate. Succes!"}"
ObjectId("5ad9202a5419a5acff156c32"),Customer Service Advisor with Portuguese and English,https://www.ejobs.ro/user/locuri-de-munca/customer-service-advisor-with-portuguese-and-english/1033842,Capgemini Services Romania SRL,IT / Telecom|Educatie / Training|Call-center / BPO,Entry-Level (< 2 ani)|Mid-Level (2-5 ani),Iasi,ejobs,1033842,"{"id":"1033842","requirments":[],"description":[],"companyDescription":"A global leader in consulting, technology services and digital transformation, Capgemini is at the forefront of innovation to address the entire breadth of clients’ opportunities in the evolving world of cloud, digital and platforms. Building on its strong 50-year heritage and deep industry-specific expertise, Capgemini enables organizations to realize their business ambitions through an array of services from strategy to operations. Capgemini is driven by the conviction that the business value of technology comes from and through people. It is a multicultural company of 200,000 team members in over 40 countries. The Group reported 2016 global revenues of EUR 12.5 billion.  Visit us at www.capgemini.com. People matter, results count."}"
ObjectId("5ad9202a5419a5acff156c33"),SEM Specialist,https://www.ejobs.ro/user/locuri-de-munca/sem-specialist/1039941,OSF Global Services SRL,IT / Telecom,Mid-Level (2-5 ani),Iasi,ejobs,1039941,"{"id":"1039941","requirments":[],"description":["Involved in all aspects of SEM, including research, implementation and analytics, to enhance organic search visibility, search engine marketing campaign results and our web projects;","Measure efficiency of marketing campaigns and report on results;","Monitor, measure, track, analyze and report on performance, reputation, local search and trends;","Track, report and assess websites/blogs, use metrics to support improved website and social media content delivery strategies."],"companyDescription":"With headquarters in Quebec, Canada, we are a leading global cloud solutions company, with expertise in enterprise CRM, ecommerce, content management and cloud applications. Delivering innovative solutions to enterprises and emerging businesses across B2B and B2C sectors, our work ranges across the digital spectrum and includes websites large and small, mobile apps, CRM programs, customized tools, content and email marketing, SEO/SEM, social media marketing and many more."}"
ObjectId("5ad9202a5419a5acff156c34"),Customer Service Advisor with French & English,https://www.ejobs.ro/user/locuri-de-munca/customer-service-advisor-with-french-english/1033840,Capgemini Romania,Call-center / BPO|IT / Telecom,Entry-Level (< 2 ani)|Mid-Level (2-5 ani),Iasi,ejobs,1033840,"{"id":"1033840","requirments":[],"description":[],"companyDescription":"A global leader in consulting, technology services and digital transformation, Capgemini is at the forefront of innovation to address the entire breadth of clients’ opportunities in the evolving world of cloud, digital and platforms. Building on its strong 50-year heritage and deep industry-specific expertise, Capgemini enables organizations to realize their business ambitions through an array of services from strategy to operations. Capgemini is driven by the conviction that the business value of technology comes from and through people. It is a multicultural company of 200,000 team members in over 40 countries. The Group reported 2016 global revenues of EUR 12.5 billion.  Visit us at www.capgemini.com. People matter, results count."}"
ObjectId("5ad9202a5419a5acff156c35"),Customer Service Advisor with Italian & English,https://www.ejobs.ro/user/locuri-de-munca/customer-service-advisor-with-italian-english/1033835,Capgemini Romania | Iasi,Call-center / BPO|IT / Telecom,Entry-Level (< 2 ani)|Mid-Level (2-5 ani),Iasi,ejobs,1033835,"{"id":"1033835","requirments":[],"description":[],"companyDescription":"A global leader in consulting, technology services and digital transformation, Capgemini is at the forefront of innovation to address the entire breadth of clients’ opportunities in the evolving world of cloud, digital and platforms. Building on its strong 50-year heritage and deep industry-specific expertise, Capgemini enables organizations to realize their business ambitions through an array of services from strategy to operations. Capgemini is driven by the conviction that the business value of technology comes from and through people. It is a multicultural company of 200,000 team members in over 40 countries. The Group reported 2016 global revenues of EUR 12.5 billion. Visit us at www.capgemini.com. People matter, results count."}"
ObjectId("5ad9202a5419a5acff156c36"),Inginer proiectant instalatii electrice,https://www.ejobs.ro/user/locuri-de-munca/inginer-proiectant-instalatii-electrice/1038618,Quartz Matrix,Energetica|Constructii|IT / Telecom,Mid-Level (2-5 ani),Iasi,ejobs,1038618,"{"id":"1038618","requirments":[],"description":[],"companyDescription":"Compania Quartz Matrix este lider regional pe piata solutiilor IT, Securitate si Eficienta energetica. Este o companie dinamica cu solide competente tehnologice. In cadrul companiei, exista un Departament de Proiectare, cu experienta in realizarea de proiecte complexe si care reuneste intr-o singura echipa competentele din domeniul electric: instalatii electrice de curenti tari, sisteme de curenti slabi, sisteme de securitate, sisteme de detectie, semnalizare si alarmare in caz de incendiu, sisteme de stingere, instalatii de evacuare a fumului si a gazelor fierbinti."}"
ObjectId("5ad9202a5419a5acff156c37"),Training Specialist,https://www.ejobs.ro/user/locuri-de-munca/training-specialist/1037627,UPC Romania,Banci / Servicii financiare|Educatie / Training|Farma|IT / Telecom,Mid-Level (2-5 ani)|Entry-Level (< 2 ani),Iasi,ejobs,1037627,"{"id":"1037627","requirments":[],"description":[],"companyDescription":"UPC România este una dintre cele mai mari companii de comunicaţii prin cablu din ţara noastră, oferind servicii de televiziune prin cablu şi prin satelit, internet de mare viteză şi telefonie fixă digitală. Reţelele UPC România deservesc, în acest moment, peste 1 milion de clienţi, în aproximativ 300 de localități. Premierele UPC pe piața din Romania includ lansarea televiziunii digitale, a tehnologiilor HD, DVR, 3D, dar și a internetului de mare viteză, Fiber Power 500 Mbps. Serviciile UPC au devenit în 2014 disponibile şi în afara casei, prin lansarile UPC Wi-Free şi Horizon Go. UPC România este afiliata la Liberty Global, Inc.."}"
ObjectId("5ad9202a5419a5acff156c38"),Inginer Automatist / PLC Programmer,https://www.ejobs.ro/user/locuri-de-munca/inginer-automatist-plc-programmer/1032003,DUMITRIU INDUSTRIAL AUTOMATION SRL,Masini / Auto|Navala / Aeronautica|IT / Telecom,Entry-Level (< 2 ani)|Mid-Level (2-5 ani),Iasi,ejobs,1032003,"{"id":"1032003","requirments":[],"description":[],"companyDescription":"Suntem este o companie nouă, formată din ingineri tineri care operează la nivel internațional în domeniul automatizărilor , în special în sectorul automotive. Noi ne ocupăm de programarea și punerea în funcțiune a mașinilor și a stațiilor industriale. Clienții nostri sunt companii internaționale care se ocupă cu proiectarea , construcția și programarea mașinilor și stațiilor industriale. Proiectele clienților noștri sunt pentru marele companii din domeniul automotive : Daimler, BMW , Volkswagen, Jaguar &LandRover, Volvo ."}"
ObjectId("5ad9202a5419a5acff156c39"),Area Sales Manager,https://www.ejobs.ro/user/locuri-de-munca/area-sales-manager/1037046,TRACKNAMIC SRL,IT / Telecom,Mid-Level (2-5 ani)|Senior-Level (> 5 ani),Iasi,ejobs,1037046,"{"id":"1037046","requirments":[],"description":[],"companyDescription":"Tracknamic este o firma inovatoare din sectorul IT. Firma face parte dintr-un grup mai mare de companii. In cadrul grupului se face consultanta, se dezvolta aplicatii informatice de serie, se fac aplicatii la comanda bazate pe tehnologii SAP, Microsoft si altele, se face cercetare in domeniul IT, electronica si automatizari. Produsul principal al firmei Tracknamic este o aplicatie inovativa de monitorizare GPS si fleetmanagement, www.tracknamic.ro."}"
ObjectId("5ad9202a5419a5acff156c3a"),PROIECTANT ELECTRONIC IN AUTOMOTIVE,https://www.ejobs.ro/user/locuri-de-munca/proiectant-electronic-in-automotive/1038297,VIMERCATI EAST EUROPE,IT / Telecom|Masini / Auto,Mid-Level (2-5 ani)|Senior-Level (> 5 ani),Iasi,ejobs,1038297,"{"id":"1038297","requirments":[],"description":[],"companyDescription":"VIMERCATI EAST EUROPE SRL cu sediul in incinta Parcului Industrial Hit Park din Hemeius-Bacau, parte a grupului VIMERCATI, Milano, Italia este o companie romaneasca infiintata in decembrie 2007, care produce intrerupatoare, comutatoare, dispozitive electromecanice, electrice si electronice pentru industria auto."}"
ObjectId("5ad9202a5419a5acff156c3b"),Coordonator vanzari rezidentiale D2D,https://www.ejobs.ro/user/locuri-de-munca/coordonator-vanzari-rezidentiale-d2d/1035259,UPC Romania,IT / Telecom,Entry-Level (< 2 ani)|Mid-Level (2-5 ani),Iasi,ejobs,1035259,"{"id":"1035259","requirments":[],"description":[],"companyDescription":"UPC România este una dintre cele mai mari companii de comunicaţii prin cablu din ţara noastră, oferind servicii de televiziune prin cablu şi prin satelit, internet de mare viteză şi telefonie fixă digitală. Reţelele UPC România deservesc, în acest moment, peste 1 milion de clienţi, în aproximativ 300 de localități. Premierele UPC pe piața din Romania includ lansarea televiziunii digitale, a tehnologiilor HD, DVR, 3D, dar și a internetului de mare viteză, Fiber Power 500 Mbps. Serviciile UPC au devenit în 2014 disponibile şi în afara casei, prin lansarile UPC Wi-Free şi Horizon Go. UPC România este afiliata la Liberty Global, Inc.."}"
ObjectId("5ad9202a5419a5acff156c3c"),Consultant Servicii Clienti,https://www.ejobs.ro/user/locuri-de-munca/consultant-servicii-clienti/1038006,RCS & RDS,Call-center / BPO|IT / Telecom,Entry-Level (< 2 ani)|Mid-Level (2-5 ani),Iasi,ejobs,1038006,"{"id":"1038006","requirments":[],"description":[],"companyDescription":"RCS & RDS este unul dintre cei mai importanti operatori de servicii integrate de comunicatii din regiune, furnizand servicii sub brandul Digi in Romania, Ungaria, Spania si Italia. In prezent, compania este lider in Romania pe piata segmentului de servicii de televiziune prin cablu si satelit, sub brandul Digi TV, de servicii de internet, sub brandul Digi Net, dar si un furnizor alternativ de servicii de telefonie fixa, Digi Tel si telefonie mobila, Digi Mobil, care este in continua crestere si dezvoltare. Compania detine singura televiziune de stiri din Romania in format full HD, Digi24 HD, cu 8 statii regionale, 4 canale de sport, Digi Sport 1, 2, 3 si 4, un canal de filme Pay-TV, Digi Film, 3 programe de documentare, Digi World, Digi Life si Digi Animal World, un canal de muzica, Utv, 5 posturi de radio: DIGI FM, Pro FM, INFO PRO, MUSIC FM si DANCE FM."}"
ObjectId("5ad9202a5419a5acff156c3d"),Agent Vanzari Teren - Persoane Fizice,https://www.ejobs.ro/user/locuri-de-munca/agent-vanzari-teren-persoane-fizice/1035954,RCS & RDS,Prestari servicii|IT / Telecom,Entry-Level (< 2 ani)|Mid-Level (2-5 ani),Iasi,ejobs,1035954,"{"id":"1035954","requirments":[],"description":[],"companyDescription":"RCS & RDS este unul dintre cei mai importanti operatori de servicii integrate de comunicatii din regiune, furnizand servicii sub brandul Digi in Romania, Ungaria, Spania si Italia. In prezent, compania este lider in Romania pe piata segmentului de servicii de televiziune prin cablu si satelit, sub brandul Digi TV, de servicii de internet, sub brandul Digi Net, dar si un furnizor alternativ de servicii de telefonie fixa, Digi Tel si telefonie mobila, Digi Mobil, care este in continua crestere si dezvoltare. Compania detine singura televiziune de stiri din Romania in format full HD, Digi24 HD, cu 8 statii regionale, 4 canale de sport, Digi Sport 1, 2, 3 si 4, un canal de filme Pay-TV, Digi Film, 3 programe de documentare, Digi World, Digi Life si Digi Animal World, un canal de muzica, Utv, 5 posturi de radio: DIGI FM, Pro FM, INFO PRO, MUSIC FM si DANCE FM."}"
ObjectId("5ad9202a5419a5acff156c3e"),Inginer service si pif sisteme de securitate,https://www.ejobs.ro/user/locuri-de-munca/inginer-service-si-pif-sisteme-de-securitate/1038650,Quartz Matrix,IT / Telecom,Mid-Level (2-5 ani),Iasi,ejobs,1038650,"{"id":"1038650","requirments":[],"description":[],"companyDescription":"Descrierea firmei: Firma privata, cu experienta in piata solutiilor tehnologice de peste 20 de ani, cu o puternica orientare spre consultanta, dezvoltare, productie, integrare si implementare solutii IT, solutii de securitate si solutii de automatizari in industrie, angajeaza in cadrul departamentului de securitate: Inginer service si pif sisteme de securitate si comunicatii."}"
